,,,INVITE MOTION,,,
,,,NEW PERSON,,,
20/06/2023 19:23:55,can I help you with anything,"Hello! I'm Pepper, the social robot. I'm here to assist you with anything you need. How can I help you today?",,,0,
20/06/2023 19:24:13,hi spot,"Hello! Welcome to Vrije University Amsterdam. I'm Pepper, the social robot. How can I assist you today?",,,1,
20/06/2023 19:24:30,where is Spar,"The Spar store is located at campus square close to the basketball court. Take the exit right behind me, walk straight ahead, and then turn left.",,,2,
20/06/2023 19:24:41,,"Hello! I'm Pepper, the social robot. How can I assist you today?",,,3,
20/06/2023 19:24:50,what's your favorite color,Pepper: My favorite color is blue.,,,4,
20/06/2023 19:25:00,why,Hello! How can I assist you today?,,,5,
,,,quit,,,
,,,INVITE MOTION,,,
23/06/2023 11:00:48,what's your name,My name is Pepper. How can I assist you today?,,,0,
23/06/2023 11:01:08,I'm looking for a place to study,"There are several study areas on the 1st to 6th floors of Wings A and B. You can take either the lifts right behind me or those straight ahead and to the left, near the other entrance.",,,1,
23/06/2023 11:01:15,thank you,You're welcome! How may I assist you today?,,,2,
23/06/2023 11:01:37,what's your favorite food,"As Pepper, I don't eat food or have a favorite food. I am powered by electricity and my main goal is to assist you with any questions you have about the university or give you directions. How can I help you find your way around the campus?",,,3,
23/06/2023 11:02:04,what's the best place to study on campus,"There are several great study areas on campus. Silent study areas are located at the 1st floor-Wing A, 2nd floor-Wing B, 3rd floor-Wing B, and 5th floor-Wing A. Study areas for group work are located on the 2nd floor - Wing B and 4th floor-Wing B.",,,4,
23/06/2023 11:02:24,are there any science study areas,"Yes, there are several study areas for science students. They are located on the 1st to 6th floors of Wings A and B. You can take either the lifts right behind me or those straight ahead and to the left, near the other entrance.",,,5,
23/06/2023 11:02:39,Study Island silent study areas,"The silent study areas are located on the 1st floor of Wing A, 2nd floor of Wing B, 3rd floor of Wing B, and 5th floor of Wing A.",,,6,
23/06/2023 11:02:47,ok bye,Goodbye! Have a nice day!,,,7,
,,,IGNORED,,,
,,,IGNORED,,,
,,,IGNORED,,,
,,,NEW PERSON,,,
23/06/2023 11:03:09,I'm looking for a place to eat,"The restaurant is on this floor, straight ahead.",,,8,
23/06/2023 11:03:22,what can I get there,"I'm sorry, I didn't understand which place you are referring to. Could you please specify the location?",,,9,
23/06/2023 11:03:36,what can I get at the cafeteria,"At the cafeteria, you can get a variety of food and drinks, including sandwiches, salads, hot meals, and beverages.",,,10,
